id,name,reb,ast,stl,blk,tov,pts,src,teamSrc,team,newsDate,newsIntro,newsTitle,newsUrl
f261b41c-434f-44d2-909d-868e1025e767,Kevin Porter,4.266666666666667,5.333333333333333,1.2666666666666666,0.4,4.333333333333333,12.8,https://cdn.nba.com/headshots/nba/latest/260x190/1629645.png,https://cdn.nba.com/logos/nba/1610612745/primary/L/logo.svg,Houston Rockets,12/11;12/10;12/10,Rockets big man Christian Wood thinks the team's impressive...;The Houston Rockets have been abysmal with Jalen Green and Kevin...;The Houston Rockets gave big minutes to Jalen Green and Kevin...,"HoopsRumors: Rockets Notes: Wood, Shooters, Christopher, Green;Space City Scoop: 3 ways the Houston Rockets can be better with Jalen Green and Kevin Porter Jr;Space City Scoop: Are the Houston Rockets Better Without Jalen Green and Kevin Porter Jr? ",https://www.hoopsrumors.com/2021/12/rockets-notes-wood-shooters-christopher-green.html;https://spacecityscoop.com/posts/3-ways-houston-rockets-better-with-jalen-green-kevin-porter;https://spacecityscoop.com/posts/are-the-houston-rockets-better-without-jalen-green-kevin-porter-jr
1bea3e40-e6da-4cd8-8c8c-01d7ddd0132f,Michael Porter,6.555555555555555,1.8888888888888888,1.1111111111111112,0.2222222222222222,1.3333333333333333,9.88888888888889,https://cdn.nba.com/headshots/nba/latest/260x190/1629008.png,https://cdn.nba.com/logos/nba/1610612743/primary/L/logo.svg,Denver Nuggets,12/10;12/7;12/5,"The NBA season is over a quarter of the way through, with most...;Lakers forward Trevor Ariza participated in a live action scrimmage...;The Nuggets‘ need to upgrade their perimeter defense prompted...","Overtime Heroics: Five Most Disappointing NBA Teams So Far;HoopsRumors: Western Notes: Ariza, Nunn, Nuggets, D'Antoni;HoopsRumors: Northwest Notes: Gordon, Hampton, Porter, Jazz, Daigneault",https://www.overtimeheroics.net/2021/12/10/five-most-disappointing-nba-teams-so-far/;https://www.hoopsrumors.com/2021/12/western-notes-ariza-nunn-nuggets-dantoni.html;https://www.hoopsrumors.com/2021/12/northwest-notes-gordon-hampton-porter-jazz-daigneault.html
f16cef9c-c25f-4042-b205-ba06881d5439,Otto Porter,4.25,1.0,0.875,0.375,0.625,6.9375,https://cdn.nba.com/headshots/nba/latest/260x190/203490.png,https://cdn.nba.com/logos/nba/1610612744/primary/L/logo.svg,Golden State Warriors,12/9;12/5;12/4,"Stephen Curry didn't break the 3-point record Wednesday night,...;The hole the Warriors dug for themselves Saturday was just a little...;The Golden State Warriors took down the Phoenix Suns, and it was...","SFBay: Curry record takes back seat as defense carries Warriors past Portland;SFBay: Warriors, Curry struggle early, fall short to Spurs despite late surge;Blue Man Hoop: Golden State Warriors bench was major difference in win over Suns",https://sfbayca.com/2021/12/08/curry-record-takes-back-seat-as-defense-carries-warriors-past-portland/;https://sfbayca.com/2021/12/04/warriors-curry-struggle-early-fall-short-to-spurs-despite-late-surge/;https://bluemanhoop.com/2021/12/04/golden-state-warriors-bench-major-difference-suns/
fe35bb65-2ad8-48f2-91ed-d471f58b4867,Bobby Portis,8.571428571428571,1.3571428571428572,0.7142857142857143,0.7857142857142857,1.5714285714285714,15.714285714285714,https://cdn.nba.com/headshots/nba/latest/260x190/1626171.png,https://cdn.nba.com/logos/nba/1610612749/primary/L/logo.svg,Milwaukee Bucks,12/9;12/9;12/8,"When the Milwaukee Bucks signed Bobby Portis to a contract in...;After losing to the Memphis Grizzlies, the Miami Heat had to get...;The Milwaukee Bucks stunned the basketball world last season...",Behind the Buck Pass: How Bobby Portis has found new life since joining the Milwaukee Bucks;Prime Time Sports Talk: Heating Up: Bucks vs Heat Reaction;The Cold Wire: The Bucks Are Officially Back On Track For A Title Defense,https://behindthebuckpass.com/2021/12/09/bobby-portis-life-joining-milwaukee-bucks/;https://primetimesportstalk.com/2021/12/09/heating-up-bucks-vs-heat-reaction-2/;https://www.thecoldwire.com/the-bucks-are-officially-back-on-track-for-a-title-defense/
ac65711b-4c8b-4f2f-be70-64b1e6c9168d,Kristaps Porzingis,8.166666666666666,1.9166666666666667,0.8333333333333334,1.5,1.6666666666666667,21.08333333333333,https://cdn.nba.com/headshots/nba/latest/260x190/204001.png,https://cdn.nba.com/logos/nba/1610612742/primary/L/logo.svg,Dallas Mavericks,12/10;12/9;12/9,"The Dallas Mavericks are looking to build on their eight-point...;Nuggets guard Facundo Campazzo, who played professionally in Argentina...;The Dallas Mavericks are in somewhat of a disarray. Luka Doncic is...","FortyEightMinutes: Mavericks-Pacers: Odds, Notes, Injuries, Key Trends;HoopsRumors: Northwest Notes: Campazzo, Hyland, Bol, Dozier, Dort, Gobert;Last Word on Sports: Dallas Mavericks: Two Trades to Fix the Team",https://fortyeightminutes.com/mavericks-pacers-odds-notes-injuries-key-trends/;https://www.hoopsrumors.com/2021/12/northwest-notes-campazzo-hyland-bol-dozier-dort-gobert.html;https://lastwordonsports.com/basketball/2021/12/09/dallas-mavericks-two-trades-to-fix-the-team/
500661bf-d89e-4dae-b372-3645a37deea0,Dwight Powell,5.176470588235294,1.1764705882352942,0.5882352941176471,0.7647058823529411,0.8235294117647058,6.588235294117647,https://cdn.nba.com/headshots/nba/latest/260x190/203939.png,https://cdn.nba.com/logos/nba/1610612742/primary/L/logo.svg,Dallas Mavericks,12/10;12/9;12/8,"The Dallas Mavericks are looking to build on their eight-point...;The Dallas Mavericks are in somewhat of a disarray. Luka Doncic is...;The Indiana Pacers are inching towards a rebuild, and are open...","FortyEightMinutes: Mavericks-Pacers: Odds, Notes, Injuries, Key Trends;Last Word on Sports: Dallas Mavericks: Two Trades to Fix the Team;Last Word on Sports: Three Myles Turner Trade Ideas",https://fortyeightminutes.com/mavericks-pacers-odds-notes-injuries-key-trends/;https://lastwordonsports.com/basketball/2021/12/09/dallas-mavericks-two-trades-to-fix-the-team/;https://lastwordonsports.com/basketball/2021/12/08/three-myles-turner-trade-ideas/
67349208-8679-4fde-a035-4ffb04c6d230,Norman Powell,2.5294117647058822,1.5294117647058822,1.0,0.4117647058823529,1.0,17.0,https://cdn.nba.com/headshots/nba/latest/260x190/1626181.png,https://cdn.nba.com/logos/nba/1610612757/primary/L/logo.svg,Portland Trail Blazers,12/11;12/10;12/9,"Welcome to the 2021-2022 Fantasy Basketball Week 9 Weekly Planner!...;June 2012, Olshey was named the 12th general manager of the Portland...;One-half of the Portland Trail Blazers dynamic-duo backcourt,...",Fantasy Six Pack: 2021-22 Fantasy Basketball Week 9 Weekly Planner;Rip City Project: A short review of Neil Olshey's legacy with the Portland Trail Blazers;Pacific Northwest Sports: Portland Trail Blazers: With CJ out long term its time to experiment,https://fantasysixpack.net/2021-22-fantasy-basketball-week-9-weekly-planner/;https://ripcityproject.com/2021/12/10/neil-olsheys-legacy-with-portland-trail-blazers/;https://pacificnwsports.com/portland-trail-blazers-cj-out-long-term-time-experiment/
fd487040-585a-43c1-b595-ec7598149b2a,Joshua Primo,0.3333333333333333,0.3333333333333333,0.0,0.0,0.0,1.6666666666666667,https://cdn.nba.com/headshots/nba/latest/260x190/1630563.png,https://cdn.nba.com/logos/nba/1610612759/primary/L/logo.svg,San Antonio Spurs,12/10;12/9;12/9,"In the San Antonio Spurs' win over Denver, Josh Primo barely touched...;The San Antonio Spurs would have to give up plenty in a trade...;New concerns have emerged about Zion Williamson‘s weight...","Air Alamo: Spurs' Josh Primo Didn't Play in Win Over Denver, and That's a Good Thing;Air Alamo: Writer proposes Spurs' Josh Primo, Derrick White in trade for Domantas Sabonis;HoopsRumors: Southwest Notes: Zion, Ingram, Morant, Primo",https://airalamo.com/posts/san-antonio-spurs-josh-primo-not-playing-good-thing;https://airalamo.com/posts/writer-proposes-san-antonio-spurs-trade-josh-primo-derrick-white-domantas-sabonis;https://www.hoopsrumors.com/2021/12/southwest-notes-zion-ingram-morant-primo.html
412c8932-d58a-4cc8-89bf-ed031826ec13,Taurean Prince,1.8125,0.6875,0.375,0.0625,0.5625,3.6875,https://cdn.nba.com/headshots/nba/latest/260x190/1627752.png,https://cdn.nba.com/logos/nba/1610612750/primary/L/logo.svg,Minnesota Timberwolves,12/8;12/7;12/6,"Ricky Rubio, a 2022 second-round pick, and cash. That's what it...;Ricky Rubio has been a critical part of the Cleveland Cavaliers'...;As the Minnesota Timberwolves stare down the barrel of a Patrick...",Zone Coverage: Finch Needs To Increase Taurean Prince's Minutes To Maximize Him;Blue Man Hoop: Golden State Warriors reportedly had interest in Ricky Rubio;Zone Coverage: Could Point Ant Become A Reality For the Wolves?,https://zonecoverage.com/2021/timberwolves/finch-needs-to-increase-taurean-princes-minutes-to-maximize-him/;https://bluemanhoop.com/2021/12/07/golden-state-warriors-reportedly-interest-ricky-rubio/;https://zonecoverage.com/2021/timberwolves/could-point-ant-become-a-reality-for-the-wolves/
141e04a2-1dfe-415a-8a3c-8c01839385d7,Payton Pritchard,1.1764705882352942,1.1764705882352942,0.0,0.1176470588235294,0.6470588235294118,1.7647058823529411,https://cdn.nba.com/headshots/nba/latest/260x190/1630202.png,https://cdn.nba.com/logos/nba/1610612738/primary/L/logo.svg,Boston Celtics,12/11;12/8;11/29,"Celtics wing Josh Richardson has entered the league's health...;The Boston Celtics have been a bit chaotic to start the 2021-22...;Sunday night, the Boston Celtics managed to halt their latest...",HoopsRumors: Celtics' Josh Richardson Enters Protocols;Hardwood Houdini: What the Boston Celtics can get for the guys at the end of the bench;Hardwood Houdini: Boston Celtics: 1 stud and 1 dud from C's fluid victory over Toronto,https://www.hoopsrumors.com/2021/12/celtics-josh-richardson-enters-protocols.html;https://hardwoodhoudini.com/2021/12/08/boston-celtics-get-end-bench/;https://hardwoodhoudini.com/2021/11/29/boston-celtics-stud-dud-fluid-toronto/
92877a9d-945c-437d-b6e3-56d78c99a6d2,Immanuel Quickley,1.9444444444444444,2.1666666666666665,0.5555555555555556,0.0,0.8333333333333334,8.944444444444445,https://cdn.nba.com/headshots/nba/latest/260x190/1630193.png,https://cdn.nba.com/logos/nba/1610612752/primary/L/logo.svg,New York Knicks,12/7;12/5;12/4,BY LESLIE MONTEIRO (Photo Credit: Brad Penner/USA Today Sports)...;The Denver Nuggets blew the Knicks off their own Madison Square...;In a game that came down to the final possessions — a 110-110...,Guy Boston Sports: Knicks Lack Star to Be Elite;Knicks.City: Blown Off their Own Court. Again. Denver 113 NY 99;Knicks.City: Burned by the Refs. Brooklyn 112 NY 110,https://guybostonsports.com/knicks-lack-star-to-be-elite/?utm_source=rss&utm_medium=rss&utm_campaign=knicks-lack-star-to-be-elite;https://knicks.city/2021-22/blown-off-their-own-court-again-denver-113-ny-99/;https://knicks.city/2021-22/burned-by-the-refs-brooklyn-112-ny-110/
67426f39-512b-4d9b-a739-0e2c9860a840,Jahmi'us Ramsey,0.0,0.4,0.0,0.2,0.0,1.4,https://cdn.nba.com/headshots/nba/latest/260x190/1630186.png,https://cdn.nba.com/logos/nba/1610612758/primary/L/logo.svg,Sacramento Kings,11/27;11/16;11/12,"The Sacramento Kings take their first trip of the season down...;Hoops Rumors' up-to-date list of 2023 free agents is below....;The Stockton Kings, the NBA G-League affiliate of the Sacramento...",Overtime Heroics: Los Angeles Lakers and Sacramento Kings Game Preview;HoopsRumors: 2023 NBA Free Agents;Overtime Heroics: NBA G-League Update: Stockton Kings,https://www.overtimeheroics.net/2021/11/26/los-angeles-lakers-and-sacramento-kings-game-preview/;https://www.hoopsrumors.com/2021/11/2023-nba-free-agents.html;https://www.overtimeheroics.net/2021/11/12/nba-g-league-update-stockton-kings/
2a07ad2b-02a7-4f32-9667-e8154afd5044,Julius Randle,10.333333333333334,5.111111111111111,0.6111111111111112,0.7222222222222222,3.333333333333333,20.38888888888889,https://cdn.nba.com/headshots/nba/latest/260x190/203944.png,https://cdn.nba.com/logos/nba/1610612752/primary/L/logo.svg,New York Knicks,12/10;12/10;12/8,Julius Randle signed a four-year extension with a base value of...;The goal of the NY Knicks' season was to take another step...;It's safe to say that there are few players in the...,"HoopsRumors: Atlantic Notes: Randle, Knicks Grades, Celtics;Daily Knicks: The NY Knicks need to get creative by going old school;The Cold Wire: 3 Teams That Should Swing A Blockbuster Deal for Luka Doncic",https://www.hoopsrumors.com/2021/12/atlantic-notes-randle-knicks-grades-celtics.html;https://dailyknicks.com/2021/12/09/ny-knicks-need-to-get-creative-by-going-old-school/;https://www.thecoldwire.com/teams-that-should-swing-a-blockbuster-deal-for-luka-doncic/
e98b287f-a891-4e17-a6e6-fab00361c111,Austin Reaves,2.0,1.0,0.3,0.2,0.8,6.1,https://cdn.nba.com/headshots/nba/latest/260x190/1630559.png,https://cdn.nba.com/logos/nba/1610612747/primary/L/logo.svg,Los Angeles Lakers,11/18;11/17;11/17,The Los Angeles Lakers will be on the road for their next five...;The Los Angeles Lakers are a team with a strong roster that should...;The return of Alex Caruso was at the forefront of Lakers fans...,"FortyEightMinutes: Lakers-Bucks: Odds, Notes, Injuries, Key Trends;Overtime Heroics: 3 Key Role Players on the Lakers;thePeachBasket: The return of the ""Carushow"" and Lonzo's revenge",https://fortyeightminutes.com/lakers-bucks-odds-notes-injuries-key-trends/;https://www.overtimeheroics.net/2021/11/17/3-key-role-players-on-the-lakers/;https://thepeachbasket.net/the-return-of-the-carushow-and-lonzos-revenge/
a75b1693-2532-4eb5-89fc-3dae9a51a597,Cam Reddish,3.0526315789473686,0.8947368421052632,1.0526315789473684,0.1578947368421052,1.3157894736842106,11.789473684210526,https://cdn.nba.com/headshots/nba/latest/260x190/1629629.png,https://cdn.nba.com/logos/nba/1610612737/primary/L/logo.svg,Atlanta Hawks,12/10;12/10;12/8,"The Atlanta Hawks upgraded Cam Reddish to probable meaning that...;Hawks forward Cam Reddish, who is recovering from a wrist injury,...;The Atlanta Hawks have been going through an injury crisis which...","Soaring Down South: The impact of the Atlanta Hawks upgrading Cam Reddish to probable;HoopsRumors: Southeast Notes: Reddish, Bogdanovic, Okongwu, Hornets, Sabonis, Martin;Soaring Down South: The Atlanta Hawks injury crisis may be starting to abate",https://soaringdownsouth.com/2021/12/10/atlanta-hawks-upgrading-cam-reddish/;https://www.hoopsrumors.com/2021/12/southeast-notes-reddish-bogdanovic-okongwu-hornets-sabonis-martin.html;https://soaringdownsouth.com/2021/12/08/atlanta-hawks-injury-crisis-abating/
60d5545a-626c-4fac-9243-a22a54a9920a,Paul Reed,2.7142857142857144,0.5714285714285714,0.6428571428571429,0.6428571428571429,0.4285714285714285,2.571428571428572,https://cdn.nba.com/headshots/nba/latest/260x190/1630194.png,https://cdn.nba.com/logos/nba/1610612755/primary/L/logo.svg,Philadelphia 76ers,12/9;12/7;12/1,"The Philadelphia 76ers are about to enter the trade season with...;There might finally be traction on the Ben Simmons trade front....;After winning the G-League's MVP, Rookie of the Year, and...",The Sixer Sense: Paul Reed should be the most available of the Sixers young core;The Sixer Sense: Sixers' Ben Simmons drawing interest from Damian Lillard of the Blazers;The Sixer Sense: Is Paul Reed in the Philadelphia 76ers' doghouse?,https://thesixersense.com/2021/12/09/paul-reed-available-sixers-young-core/;https://thesixersense.com/2021/12/07/sixers-ben-simmons-drawing-interest-damian-lillard-blazers/;https://thesixersense.com/2021/12/01/paul-reed-philadelphia-76ers-doghouse/
d1406d44-1232-4250-9a08-a4201e1034af,Naz Reid,3.3125,0.8125,0.625,1.0625,0.625,8.125,https://cdn.nba.com/headshots/nba/latest/260x190/1629675.png,https://cdn.nba.com/logos/nba/1610612750/primary/L/logo.svg,Minnesota Timberwolves,12/6;12/6;12/5,As the Minnesota Timberwolves stare down the barrel of a Patrick...;The Minnesota Timberwolves have returned to an area of familiarity....;The Minnesota Timberwolves are different from what we are used...,Zone Coverage: Could Point Ant Become A Reality For the Wolves?;Zone Coverage: What Do the Wolves Do With Josh Okogie?;Last Word on Sports: The Minnesota Timberwolves Finally Have a Playoff Foundation,https://zonecoverage.com/2021/timberwolves/could-point-ant-become-a-reality-for-the-wolves/;https://zonecoverage.com/2021/timberwolves/what-do-the-wolves-do-with-josh-okogie/;https://lastwordonsports.com/basketball/2021/12/05/the-minnesota-timberwolves-finally-have-a-playoff-foundation/
f217bcc5-c3fb-47f1-bbd2-7a1eafaadb40,Nick Richards,2.066666666666667,0.2666666666666666,0.2666666666666666,0.7333333333333333,0.7333333333333333,3.6,https://cdn.nba.com/headshots/nba/latest/260x190/1630208.png,https://cdn.nba.com/logos/nba/1610612766/primary/L/logo.svg,Charlotte Hornets,11/16;10/31;10/3,"Hoops Rumors' up-to-date list of 2023 free agents is below....;The 3-3 Hawks have yet to find the rhythm that propelled them...;With the start of the 2021-22 season right around the corner,...","HoopsRumors: 2023 NBA Free Agents;HoopsRumors: Southeast Notes: Hawks, Hornets, Riley, Butler;Swarm and Sting: Charlotte Hornets 2021 Player preview: Can Nick Richards make the final roster?",https://www.hoopsrumors.com/2021/11/2023-nba-free-agents.html;https://www.hoopsrumors.com/2021/10/southeast-notes-hawks-hornets-riley-butler.html;https://swarmandsting.com/2021/10/03/charlotte-hornets-2021-player-preview-nick-richards/
b3106e60-b4e1-48f4-9a4f-c1429a6c7295,Josh Richardson,3.142857142857143,1.2142857142857142,0.5714285714285714,0.5714285714285714,0.7857142857142857,8.857142857142858,https://cdn.nba.com/headshots/nba/latest/260x190/1626196.png,https://cdn.nba.com/logos/nba/1610612738/primary/L/logo.svg,Boston Celtics,12/11;12/4;12/1,Celtics wing Josh Richardson has entered the league's health...;I was confused when Brad Stevens decided to bring Josh Richardson...;The first two months of the 2021-22 NBA season may have proven...,HoopsRumors: Celtics' Josh Richardson Enters Protocols;Hardwood Houdini: Boston Celtics: Checking in on the progress of Josh Richardson;Hardwood Houdini: 3 Boston Celtics players that need to step up in December,https://www.hoopsrumors.com/2021/12/celtics-josh-richardson-enters-protocols.html;https://hardwoodhoudini.com/2021/12/04/boston-celtics-checking-josh-richardson/;https://hardwoodhoudini.com/2021/12/01/boston-celtics-players-december/
1c8118c8-0a5e-4e20-8de1-30c73ec1fe50,Austin Rivers,1.5,0.8125,0.5625,0.125,0.625,3.9375,https://cdn.nba.com/headshots/nba/latest/260x190/203085.png,https://cdn.nba.com/logos/nba/1610612743/primary/L/logo.svg,Denver Nuggets,12/10;12/6;12/5,"No matter what Damian Lillard says, everyone knows he's...;A four-game winning streak may seem like an average amount of...;The first quarter of the NBA season is done. Most teams have already...","The Cold Wire: Why Is Damian Lillard So Unhappy?;Project Spurs: San Antonio Spurs look to remain hot, faced with five-game slate this week;Prime Time Sports Talk: NBA Week 8: Unmissable Games",https://www.thecoldwire.com/why-is-damian-lillard-so-unhappy/;https://projectspurs.com/2021/12/06/san-antonio-spurs-look-to-remain-hot-faced-with-five-game-slate-this-week/;https://primetimesportstalk.com/2021/12/05/nba-week-8-unmissable-games/
97eb7069-085f-4b67-84b2-f6e28f765631,Duncan Robinson,4.0,1.4736842105263157,0.8421052631578947,0.3157894736842105,0.8947368421052632,11.0,https://cdn.nba.com/headshots/nba/latest/260x190/1629130.png,https://cdn.nba.com/logos/nba/1610612748/primary/L/logo.svg,Miami Heat,12/9;12/7;12/7,"The Caleb Martin Show. That's what viewers tuned in to when...;The Miami Heat expected a far better outcome for their return...;It wasn't to be for the Miami Heat, trying to withstand an uber-competitive...","HoopsWire: Miami Heat Defeat The Milwaukee Bucks Despite Missing Butler, Adebayo;Prime Time Sports Talk: Heating Up: Grizzlies vs Heat Reaction;All U Can Heat: Miami Heat: Caleb Martin Deserves 2022 NBA Dunk Contest Bid",https://hoopswire.com/miami-heat-defeat-the-milwaukee-bucks-despite-missing-butler-adebayo/;https://primetimesportstalk.com/2021/12/07/heating-up-grizzlies-vs-heat-reaction/;https://allucanheat.com/2021/12/07/miami-heat-caleb-martin-dunk-contest-bid/
29af6a0f-2e44-4f2a-b0f8-d04e49c3a0a7,Justin Robinson,0.8125,1.3125,0.5,0.0,0.6875,3.0,https://cdn.nba.com/headshots/nba/latest/260x190/1629620.png,https://cdn.nba.com/logos/nba/1610612749/primary/L/logo.svg,Milwaukee Bucks,11/30;11/29;11/3,The Bucks are signing guard Javonte Smart to a two-way contract...;The Bucks intend to sign guard Javonte Smart to a two-way contract...;The Milwaukee Bucks have now gotten themselves back to the .500...,"HoopsWire: Bucks To Sign Javonte Smart, Waive Justin Robinson;HoopsRumors: Bucks To Sign Javonte Smart, Waive Justin Robinson;FortyEightMinutes: Giannis Antetokounmpo Leads Bucks To Blowout Victory Over Pistons",https://hoopswire.com/bucks-to-sign-javonte-smart-waive-justin-robinson/;https://www.hoopsrumors.com/2021/11/bucks-to-sign-javonte-smart-waive-justin-robinson.html;https://fortyeightminutes.com/giannis-antetokounmpo-leads-bucks-to-blowout-victory-over-pistons/
9edcac3b-6038-44dc-a8d6-b99e14dca615,Mitchell Robinson,7.6,0.8,0.4,1.6666666666666667,0.6666666666666666,7.133333333333334,https://cdn.nba.com/headshots/nba/latest/260x190/1629011.png,https://cdn.nba.com/logos/nba/1610612752/primary/L/logo.svg,New York Knicks,12/9;12/8;12/7,The Nets are resting Kevin Durant and LaMarcus Aldridge for tonight's...;The return of springy young Nets big man Nicolas Claxton to action...;Knicks coach Tom Thibodeau has already made one notable change...,"HoopsRumors: New York Notes: Durant, Harden, Turner, Barrett;HoopsRumors: New York Notes: Claxton, Kemba, Noel, Thibs;HoopsWire: Tom Thibodeau's Next Change Could Be At Center Of Knicks",https://www.hoopsrumors.com/2021/12/new-york-notes-durant-harden-turner-barrett.html;https://www.hoopsrumors.com/2021/12/new-york-notes-claxton-kemba-noel-thibs.html;https://hoopswire.com/tom-thibodeaus-next-change-could-be-at-center-of-knicks/
070549db-e520-4d20-9246-d0f706e8ab37,Jeremiah Robinson-Earl,5.722222222222222,0.8888888888888888,0.6666666666666666,0.3333333333333333,0.8333333333333334,7.166666666666667,https://cdn.nba.com/headshots/nba/latest/260x190/1630526.png,https://cdn.nba.com/logos/nba/1610612760/primary/L/logo.svg,Oklahoma City Thunder,12/7;12/6;12/4,"Quality NBA talent can be found at any pick throughout...;After six weeks of NBA games, the 2021 rookie class is living...;The second round of the NBA draft is where teams can really swing...",The Cold Wire: 2 2021 NBA Second-Round Picks Turning Heads So Far;Thunderous Intentions: TI's week 6 rookie ladder: OKC Thunder Giddey cements his place;Hoops Habit: 4 second-round NBA rookies that already look like steals,https://www.thecoldwire.com/nba-second-round-picks-turning-heads-so-far/;https://thunderousintentions.com/2021/12/05/okc-thunder-tis-w6-rookie-rankings/;https://hoopshabit.com/2021/12/04/second-round-nba-rookies-steals/
d1f7a35d-4b6e-4246-a067-9dbdd439b4ec,Isaiah Roby,2.4444444444444446,0.6666666666666666,0.1111111111111111,0.2222222222222222,0.4444444444444444,5.222222222222222,https://cdn.nba.com/headshots/nba/latest/260x190/1629676.png,https://cdn.nba.com/logos/nba/1610612760/primary/L/logo.svg,Oklahoma City Thunder,12/7;12/7;12/1,"The Oklahoma City Thunder organization believes in utilizing their...;Here is an article about Thunder Player Grades PT. 2. More players...;After playing a regular role for the Thunder in 2020/21, Isaiah...","Thunderous Intentions: OKC Blue get strong lift from Thunder training camp invites Wilson, Sarr;The Game Haus: Thunder Player Grades PT. 2;HoopsRumors: Thunder Notes: Roby, Watson, Deck, Player Development",https://thunderousintentions.com/2021/12/07/okc-blue-thunder-training-camp-invites/;https://thegamehaus.com/nba/thunder-player-grades-pt-2/2021/12/07/;https://www.hoopsrumors.com/2021/11/thunder-notes-roby-watson-deck-player-development.html
54c46b1a-c144-4155-9d85-8cec0efdf06f,Rajon Rondo,2.1538461538461537,3.769230769230769,0.8461538461538461,0.2307692307692307,1.6923076923076923,3.3076923076923075,https://cdn.nba.com/headshots/nba/latest/260x190/200765.png,https://cdn.nba.com/logos/nba/1610612747/primary/L/logo.svg,Los Angeles Lakers,12/2;11/29;11/26,"To be fair, Russell Westbrook is a great player and he's one of...;The 2021-22 Boston Celtics have been quite average, and...;It might be surprising to some basketball enthusiasts, but the...",thePeachBasket: The Lakers need to trade Russell Westbrook;The Cold Wire: Who Is The Boston Celtics' X-Factor This Year?;Last Word on Sports: The Los Angeles Lakers At Risk of Missing the NBA Playoffs,https://thepeachbasket.net/the-lakers-need-to-trade-russell-westbrook/;https://www.thecoldwire.com/who-is-the-boston-celtics-x-factor-this-year/;https://lastwordonsports.com/basketball/2021/11/26/los-angeles-lakers-playoffs/
84e4a2f1-1884-4acb-8e18-0ecb5be50bdd,Derrick Rose,2.764705882352941,3.3529411764705883,1.0,0.6470588235294118,1.411764705882353,12.0,https://cdn.nba.com/headshots/nba/latest/260x190/201565.png,https://cdn.nba.com/logos/nba/1610612752/primary/L/logo.svg,New York Knicks,12/10;12/10;12/9,Rookie guard Ayo Dosunmu has started the past two games for the...;Julius Randle signed a four-year extension with a base value of...;Before we get into the 2021-22 Fantasy Basketball Week 8 Drop...,"HoopsRumors: Central Notes: Dosunmu, Jarrett Allen, Pistons;HoopsRumors: Atlantic Notes: Randle, Knicks Grades, Celtics;Fantasy Six Pack: 2021-22 Fantasy Basketball Week 8 Drop List",https://www.hoopsrumors.com/2021/12/central-notes-dosunmu-jarrett-allen-pistons.html;https://www.hoopsrumors.com/2021/12/atlantic-notes-randle-knicks-grades-celtics.html;https://fantasysixpack.net/2021-22-fantasy-basketball-week-8-drop-list/
