id,name,reb,ast,stl,blk,tov,pts,src,teamSrc,team,newsDate,newsIntro,newsTitle,newsUrl
5917347e-a717-4ab2-8283-bfe9e8813682,Ty Jerome,1.3333333333333333,1.1333333333333333,0.8,0.1333333333333333,0.2666666666666666,6.8,https://cdn.nba.com/headshots/nba/latest/260x190/1629660.png,https://cdn.nba.com/logos/nba/1610612760/primary/L/logo.svg,Oklahoma City Thunder,11/21;11/20;11/16,"The OKC Thunder traveled to the TD Garden in Boston, Massachusetts...;When we updated our glossary entry on the NBA's salary floor...;Hoops Rumors' up-to-date list of 2023 free agents is below....","Thunderous Intentions: Josh Giddey's four three pointer night not enough vs Celtics;HoopsRumors: How Thunder Are Simultaneously Below Salary Floor, Over Cap;HoopsRumors: 2023 NBA Free Agents",https://thunderousintentions.com/2021/11/21/josh-giddeys-okc-thunder-lose/;https://www.hoopsrumors.com/2021/11/how-thunder-are-simultaneously-below-salary-floor-over-cap.html;https://www.hoopsrumors.com/2021/11/2023-nba-free-agents.html
2116280e-ba78-4156-acdc-0f97c3e4747e,Isaiah Joe,1.3333333333333333,0.5,0.0,0.0,0.3333333333333333,3.6666666666666665,https://cdn.nba.com/headshots/nba/latest/260x190/1630198.png,https://cdn.nba.com/logos/nba/1610612755/primary/L/logo.svg,Philadelphia 76ers,12/11;12/9;11/28,"Boy oh boy, Furkan Korkmaz is playing poorly for the Philadelphia...;The Philadelphia 76ers are about to enter the trade season with...;After missing the past nine games due to COVID-19, Sixers center...",Section 215: The Philadelphia 76ers can't trade Furkan Korkmaz (literally);The Sixer Sense: Paul Reed should be the most available of the Sixers young core;HoopsRumors: Joel Embiid Cleared To Return For Sixers,https://section215.com/2021/12/10/philadelphia-76ers-cant-trade-korkmaz/;https://thesixersense.com/2021/12/09/paul-reed-available-sixers-young-core/;https://www.hoopsrumors.com/2021/11/joel-embiid-cleared-to-return-for-sixers.html
4284541a-fbab-438d-8ed1-1c93c1ddefea,Alize Johnson,2.4166666666666665,0.5,0.25,0.0,0.5,2.25,https://cdn.nba.com/headshots/nba/latest/260x190/1628993.png,https://cdn.nba.com/logos/nba/1610612741/primary/L/logo.svg,Chicago Bulls,12/2;11/27;11/26,"In the next two games, the Chicago Bulls have a shot to keep establishing...;As the Chicago Bulls prepare to take on one of the better teams...;Bulls starting center Nikola Vucevic is off to a slow shooting...",Pippen Ain't Easy: 3 most tradable Bulls players through the first 22 games;Pippen Ain't Easy: Chicago Bulls: Ranking every player at the quarter-mark;Overtime Heroics: Nikola Vucevic Is More Important Than You Think,https://pippenainteasy.com/2021/12/01/3-most-tradable-bulls-players-through-the-first-21-games/;https://pippenainteasy.com/2021/11/27/chicago-bulls-ranking-every-player-nearing-the-quarter-mark/;https://www.overtimeheroics.net/2021/11/24/nikola-vucevic-is-more-important-than-you-think/
f4d0d271-b814-46c8-9e41-8402a52fc203,Cameron Johnson,3.2777777777777777,1.1666666666666667,0.7777777777777778,0.2222222222222222,0.6111111111111112,8.444444444444445,https://cdn.nba.com/headshots/nba/latest/260x190/1629661.png,https://cdn.nba.com/logos/nba/1610612756/primary/L/logo.svg,Phoenix Suns,12/6;12/6;12/4,"Mark J. Rebilas-USA TODAY Sports...;Listen now (102 min) | With 23 games now in the vault, there's...;The NBA Draft is an annual gamble for all teams. While...","Bright Side Of The Sun: The Suns' Top Four Reserves Pummeled the League During Incendiary Run;The Four Point Play: Vol.3, Iss.7: A Quarter For Our Thoughts;The Cold Wire: 3 Likely Busts From The 2019 NBA Draft Class",https://www.brightsideofthesun.com/2021/12/6/22815574/phoenix-suns-top-four-reserves-pummeled-the-league-during-incendiary-run;https://thefourpointplay.substack.com/p/vol3-iss7-a-quarter-for-our-thoughts;https://www.thecoldwire.com/likely-busts-from-the-2019-nba-draft-class/
95fa915d-f0b9-49fa-8e5a-c24e567f7d35,David Johnson,0.0,0.0,0.0,0.0,0.0,0.0,https://cdn.nba.com/headshots/nba/latest/260x190/1630525.png,https://cdn.nba.com/logos/nba/1610612761/primary/L/logo.svg,Toronto Raptors,11/9;10/13;9/6,"Hoops Rumors is breaking down the 2021 offseason for all 30 NBA...;Two years after winning the championship, the Toronto Raptors...;Hoops Rumors' up-to-date list of 2022 free agents by team...",HoopsRumors: 2021 NBA Offseason In Review: Toronto Raptors;Last Word on Sports: Toronto Raptors 2021-2022 Season Preview;HoopsRumors: 2022 NBA Free Agents By Team,https://www.hoopsrumors.com/2021/11/2021-nba-offseason-in-review-toronto-raptors.html;https://lastwordonsports.com/basketball/2021/10/13/toronto-raptors-2021-2022-season-preview/;https://www.hoopsrumors.com/2021/09/2022-nba-free-agents-by-team.html
26eaf3cd-dbea-4543-a24c-85401cd81d3f,Jalen Johnson,0.7142857142857143,0.0,0.0,0.0,0.0,2.0,https://cdn.nba.com/headshots/nba/latest/260x190/1630552.png,https://cdn.nba.com/logos/nba/1610612737/primary/L/logo.svg,Atlanta Hawks,12/9;12/5;12/3,The Atlanta Hawks injury crisis may appear to be abating with...;The Atlanta Hawks are preparing to take on a very depleted Charlotte...;The College Parks Skyhawks are not a very good basketball team...,"Soaring Down South: The Atlanta Hawks rotations change with Solomon Hill out for the year;Soaring Down South: Atlanta Hawks: Johnson called up, should play against diminished Hornets;Soaring Down South: Atlanta Hawks: Are the Skyhawks the best place for Jalen Johnson's development?",https://soaringdownsouth.com/2021/12/09/atlanta-hawks-rotation-solomon-hill/;https://soaringdownsouth.com/2021/12/05/atlanta-hawks-johnson-called-play-diminished-hornets/;https://soaringdownsouth.com/2021/12/03/atlanta-hawks-jalen-johnson-develop/
54940d7f-60cb-43e5-af1b-eb65ac70c332,James Johnson,3.272727272727273,1.5454545454545454,0.4545454545454545,0.2727272727272727,0.5454545454545454,3.5454545454545454,https://cdn.nba.com/headshots/nba/latest/260x190/201949.png,https://cdn.nba.com/logos/nba/1610612751/primary/L/logo.svg,Brooklyn Nets,12/5;12/4;11/27,Free agent addition Paul Millsap turned in his best game since...;In a game that came down to the final possessions — a 110-110...;Nets big man Blake Griffin has seen his role shrink with the impressive...,"HoopsRumors: Nets Notes: Millsap, Durant, Mills, Claxton;Knicks.City: Burned by the Refs. Brooklyn 112 NY 110;HoopsRumors: Eastern Notes: Griffin, Bembry, Fultz, Capela, Bogdanovic",https://www.hoopsrumors.com/2021/12/nets-notes-millsap-durant-mills-claxton.html;https://knicks.city/2021-22/burned-by-the-refs-brooklyn-112-ny-110/;https://www.hoopsrumors.com/2021/11/eastern-notes-griffin-bembry-fultz-capela-bogdanovic.html
3efdd5b1-f6a2-4cc7-8f26-4913731dad2e,Keldon Johnson,6.0588235294117645,2.0588235294117645,1.0,0.2352941176470588,1.4705882352941178,14.941176470588236,https://cdn.nba.com/headshots/nba/latest/260x190/1629640.png,https://cdn.nba.com/logos/nba/1610612759/primary/L/logo.svg,San Antonio Spurs,12/10;12/8;12/8,"In Spurscast episode 641, Spurscast host Paul Garcia and Project...;Editor's Note: This is Trace's debut piece on Project...;The San Antonio Spurs have hit the quarter mark in their season,...",Project Spurs: Spurscast Ep. 641: Takeaways from the Four Game Winning Streak;Project Spurs: Stuff I Liked About the Spurs' Four-Game Winning Streak;Air Alamo: Spurs: Addressing 5 Unanswered Questions Through 1st Quarter of Season,https://projectspurs.com/2021/12/09/spurscast-ep-641-takeaways-from-the-four-game-winning-streak/;https://projectspurs.com/2021/12/08/stuff-i-liked-about-the-spurs-four-game-winning-streak/;https://airalamo.com/posts/san-antonio-spurs-addressing-5-unanswered-questions
8563095a-a0fa-43fb-ad2c-beab2a9b8484,Keon Johnson,0.0,0.0,0.0,0.0,0.0,0.0,https://cdn.nba.com/headshots/nba/latest/260x190/1630553.png,https://cdn.nba.com/logos/nba/1610612746/primary/L/logo.svg,LA Clippers,10/26;10/16;10/16,Hoops Rumors is breaking down the 2021 offseason for all 30 NBA...;The Tennessee Volunteers Last season ended up being a disappointment...;Hoops Rumors is breaking down the 2021 offseason for all 30 NBA...,HoopsRumors: 2021 NBA Offseason In Review: New York Knicks;Last Word on Sports: Preseason College Basketball Rankings: #23 Tennessee Volunteers;HoopsRumors: 2021 NBA Offseason In Review: Los Angeles Clippers,https://www.hoopsrumors.com/2021/10/2021-nba-offseason-in-review-new-york-knicks.html;https://lastwordonsports.com/basketball/2021/10/16/preseason-college-basketball-rankings-23-tennessee-volunteers/;https://www.hoopsrumors.com/2021/10/2021-nba-offseason-in-review-los-angeles-clippers.html
621ae79e-a2e7-428d-8255-30cd9023d9ec,Nikola Jokic,13.571428571428571,6.357142857142857,1.2142857142857142,0.9285714285714286,3.2142857142857144,26.357142857142858,https://cdn.nba.com/headshots/nba/latest/260x190/203999.png,https://cdn.nba.com/logos/nba/1610612743/primary/L/logo.svg,Denver Nuggets,12/11;12/10;12/10,Warriors star Stephen Curry is running away with the early season...;It's been a predictably up-and-down first quarter of the NBA season...;SAN ANTONIO — The San Antonio Spurs snapped a two-game losing...,"HoopsRumors: Pacific Notes: Curry, Ayton, AD, Ariza, Holmes;Zone Coverage: The Wolves Will Be Fine If They Can Survive December;Project Spurs: Spurs Hold Off Nuggets To Open Home And Home Series",https://www.hoopsrumors.com/2021/12/pacific-notes-curry-ayton-ad-ariza-holmes.html;https://zonecoverage.com/2021/timberwolves/wolves-must-survive-december-for-playoff-push/;https://projectspurs.com/2021/12/10/spurs-hold-off-nuggets-to-open-home-and-home-series/
b2e9e1d4-3888-4dbe-b78d-f6585a4b90d6,Damian Jones,3.142857142857143,0.5714285714285714,0.0,0.2857142857142857,0.1428571428571428,3.4285714285714284,https://cdn.nba.com/headshots/nba/latest/260x190/1627745.png,https://cdn.nba.com/logos/nba/1610612758/primary/L/logo.svg,Sacramento Kings,10/12;9/29;9/27,"Dwyane Wade‘s son Zaire Wade is signing an NBA G League...;Most of the talk, regionally and nationally, claim that the Sacramento...;Most of the talk, regionally and nationally, claim that the Sacramento...","HoopsRumors: Western Notes: Wade, Jazz, Kings, Winslow, Suns, Thunder;Overtime Heroics: Three Reasons to Watch: Sacramento Kings Big Men;Overtime Heroics: Sacramento Kings Offseason: Big Men",https://www.hoopsrumors.com/2021/10/western-notes-wade-jazz-kings-winslow-suns-thunder.html;https://www.overtimeheroics.net/2021/09/29/three-reasons-to-watch-sacramento-kings-big-men/;https://www.overtimeheroics.net/2021/09/27/sacramento-kings-offseason-big-men/
e79474ff-f9f7-4a8a-ae99-8c2d52c3da7b,Derrick Jones,3.8,0.5333333333333333,0.6,0.8666666666666667,0.4666666666666667,6.933333333333334,https://cdn.nba.com/headshots/nba/latest/260x190/1627884.png,https://cdn.nba.com/logos/nba/1610612741/primary/L/logo.svg,Chicago Bulls,12/10;12/10;12/10,"The Bulls are signing small forward Alfonzo McKinnie via the NBA's...;11:35am: McKinnie has signed a 10-day contract, the Bulls announced...;Raptors president Masai Ujiri has tested positive for COVID-19,...","HoopsWire: Bulls To Sign Alfonzo McKinnie Via Hardship Exception;HoopsRumors: Bulls Sign Alfonzo McKinnie With Hardship Exception;HoopsRumors: COVID-19 Updates: Ujiri, Brooks, Young",https://hoopswire.com/bulls-to-sign-alfonzo-mckinnie-via-hardship-exception/;https://www.hoopsrumors.com/2021/12/bulls-to-sign-alfonzo-mckinnie-with-hardship-exception.html;https://www.hoopsrumors.com/2021/12/covid-19-updates-ujiri-brooks-young.html
1b6c16aa-3ffb-4b43-a99a-4fcbdfa286f7,Herb Jones,3.3529411764705883,1.6470588235294117,1.2941176470588236,0.6470588235294118,1.2352941176470589,5.882352941176471,https://cdn.nba.com/headshots/nba/latest/260x190/1630529.png,https://cdn.nba.com/logos/nba/1610612740/primary/L/logo.svg,New Orleans Pelicans,12/7;12/5;12/4,Quality NBA talent can be found at any pick throughout...;Grizzlies star Ja Morant is making progress in his rehab from...;The second round of the NBA draft is where teams can really swing...,"The Cold Wire: 2 2021 NBA Second-Round Picks Turning Heads So Far;HoopsRumors: Southwest Notes: Morant, Doncic, Williamson, Jones;Hoops Habit: 4 second-round NBA rookies that already look like steals",https://www.thecoldwire.com/nba-second-round-picks-turning-heads-so-far/;https://www.hoopsrumors.com/2021/12/southwest-notes-morant-doncic-williamson-jones.html;https://hoopshabit.com/2021/12/04/second-round-nba-rookies-steals/
713a3f88-6c35-4378-a886-8e52402ae979,Kai Jones,0.0,0.0,0.0,0.0,0.6,0.0,https://cdn.nba.com/headshots/nba/latest/260x190/1630539.png,https://cdn.nba.com/logos/nba/1610612766/primary/L/logo.svg,Charlotte Hornets,12/9;12/4;10/27,Rick Carlisle planned to coach a contender when he was hired by...;Magic guard Cole Anthony is an early-season candidate for Most...;New Wizards reserve big man Montrezl Harrell has emerged as one...,"HoopsRumors: Pacers Notes: Carlisle, Simmons, Duarte, Turner;HoopsRumors: Southeast Notes: Anthony, Yurtseven, Dedmon, Hornets;HoopsRumors: Southeast Notes: Harrell, Wall, Artest III, Hornets",https://www.hoopsrumors.com/2021/12/pacers-notes-carlisle-simmons-duarte-turner.html;https://www.hoopsrumors.com/2021/12/southeast-notes-anthony-yurtseven-dedmon-hornets.html;https://www.hoopsrumors.com/2021/10/southeast-notes-harrell-wall-artest-iii-hornets.html
89d9e7e0-c7a9-4d76-8488-8fbce0f57177,Tre Jones,0.8666666666666667,1.2666666666666666,0.2666666666666666,0.0,0.4666666666666667,3.466666666666667,https://cdn.nba.com/headshots/nba/latest/260x190/1630200.png,https://cdn.nba.com/logos/nba/1610612759/primary/L/logo.svg,San Antonio Spurs,12/6;11/30;11/16,"As the San Antonio Spurs continue to establish themselves, many...;In Spurscast episode 639, Spurscast host Paul Garcia discusses...;Hoops Rumors' up-to-date list of 2023 free agents is below....",Air Alamo: Air Alamo Staff Grades 3 Proposed San Antonio Spurs Trades;Project Spurs: Spurscast Ep. 639: Can the Spurs get back into the Top 10 defensively?;HoopsRumors: 2023 NBA Free Agents,https://airalamo.com/posts/grading-3-proposed-san-antonio-spurs-trades-jakob-poeltl-james-wiseman;https://projectspurs.com/2021/11/30/spurscast-ep-639-can-the-spurs-get-back-into-the-top-10-defensively/;https://www.hoopsrumors.com/2021/11/2023-nba-free-agents.html
0393be1b-532d-4d4f-87e1-9600947a5a54,Tyus Jones,2.1666666666666665,3.111111111111111,0.6666666666666666,0.0555555555555555,0.5555555555555556,5.944444444444445,https://cdn.nba.com/headshots/nba/latest/260x190/1626145.png,https://cdn.nba.com/logos/nba/1610612763/primary/L/logo.svg,Memphis Grizzlies,12/11;12/2;11/30,"The Grizzlies, 15-11, have won six of their past seven games and...;With superstar guard Ja Morant out for an extended period of time,...;Mavericks fans have been clamoring for Moses Brown to get a longer...","HoopsRumors: Grizzlies Notes: Jackson Jr., Bane, Brooks, Defense;Beale Street Bears: Memphis Grizzlies: Tyus Jones could turn opportunity into huge payday;HoopsRumors: Southwest Notes: M. Brown, Grizzlies, Pelicans, Wall",https://www.hoopsrumors.com/2021/12/grizzlies-notes-jackson-jr-bane-brooks-defense.html;https://bealestreetbears.com/2021/12/02/memphis-grizzlies-tyus-jones-turn-opportunity-huge-payday/;https://www.hoopsrumors.com/2021/11/southwest-notes-m-brown-grizzlies-pelicans-wall.html
afd5673b-1796-4057-a7a2-0d80d2923fa2,DeAndre Jordan,6.529411764705882,0.4117647058823529,0.2941176470588235,0.8823529411764706,0.7058823529411765,4.882352941176471,https://cdn.nba.com/headshots/nba/latest/260x190/201599.png,https://cdn.nba.com/logos/nba/1610612747/primary/L/logo.svg,Los Angeles Lakers,12/8;12/5;12/3,"LeBron James knows that the Lakers' on-and-off play is under...;Before squaring off against Paul George in Friday's Lakers-Clippers...;When Blake Griffin was signed by the Brooklyn Nets, it...","HoopsWire: LeBron James Supports Frank Vogel's Handling Of Roster, Rotations;HoopsRumors: L.A. Notes: Westbrook, Howard, THT, Mann, Batum;The Cold Wire: Blake Griffin Adjusting To New Role With The Nets",https://hoopswire.com/lebron-james-supports-coach-frank-vogels-handling-of-the-roster-rotations/;https://www.hoopsrumors.com/2021/12/l-a-notes-westbrook-howard-tht-mann-batum.html;https://www.thecoldwire.com/blake-griffin-adjusting-to-new-role-with-the-nets/
0024281f-125b-4953-9cb3-821faafb0fa5,Cory Joseph,1.7222222222222223,3.5,0.8888888888888888,0.1666666666666666,1.5,6.833333333333333,https://cdn.nba.com/headshots/nba/latest/260x190/202709.png,https://cdn.nba.com/logos/nba/1610612765/primary/L/logo.svg,Detroit Pistons,12/10;12/8;12/8,The bench for the Detroit Pistons has not produced as expected...;The Washington Wizards will face off with against Detroit Pistons...;While they do not have the most financial flexibility or the richest...,"Piston Powered: Before they were Pistons: Where the bench veterans came from tells a lot;FortyEightMinutes: Wizards: Odds, DFS Notes, Key Trends Ahead of Pistons Matchup;Behind the Buck Pass: Pass or pursue on Bleacher Report's trade targets for Milwaukee Bucks",https://pistonpowered.com/2021/12/09/detroit-pistons-bench-veterans-came-tells-lot/;https://fortyeightminutes.com/wizards-pistons-odds-trends-dfs/;https://behindthebuckpass.com/2021/12/08/pass-pursue-bleacher-report-trade-targets-milwaukee-bucks/
9ae78e63-02ae-416e-ba6c-7f229764768b,Georgios Kalaitzakis,1.1428571428571428,0.0,0.1428571428571428,0.1428571428571428,0.5714285714285714,1.8571428571428568,https://cdn.nba.com/headshots/nba/latest/260x190/1630686.png,https://cdn.nba.com/logos/nba/1610612749/primary/L/logo.svg,Milwaukee Bucks,12/4;12/4;12/4,The Bucks officially announced the signing of shooting guard Wesley...;The Milwaukee Bucks continue to churn their roster.It was...;6:14 PM: The Bucks have officially signed Matthews and requested...,"HoopsWire: Wesley Matthews ‘Excited As Could Be' With Return To Bucks;Dairyland Express: Milwaukee Bucks Add to Depth & Bring Back Wes Matthews;HoopsRumors: Bucks Sign Wesley Matthews, Waive Georgios Kalaitzakis",https://hoopswire.com/wesley-matthews-excited-as-could-be-with-return-to-bucks/;https://dairylandexpress.com/2021/12/03/milwaukee-bucks-add-depth-bring-back-wes-matthews/;https://www.hoopsrumors.com/2021/12/bucks-signing-wesley-matthews-waiving-georgios-kalaitzakis.html
3695f6fb-3b7f-47c5-a51d-57cbc7f5bb9c,Frank Kaminsky,4.555555555555555,1.4444444444444444,0.8888888888888888,0.7777777777777778,0.5555555555555556,10.555555555555555,https://cdn.nba.com/headshots/nba/latest/260x190/1626163.png,https://cdn.nba.com/logos/nba/1610612756/primary/L/logo.svg,Phoenix Suns,11/25;11/22;11/22,The stress reaction that Suns big man Frank Kaminsky suffered...;The Phoenix Suns winning or the sun rising in the morning–...;Suns big man Frank Kaminsky has suffered a stress reaction of...,"HoopsRumors: Suns Notes: Kaminsky, Ayton, Sarver, Smith;The Lead: Suns Going Streaking With 12 Straight Wins;HoopsRumors: Frank Kaminsky Suffers Stress Reaction In Knee, Out Indefinitely",https://www.hoopsrumors.com/2021/11/suns-notes-kaminsky-ayton-sarver-smith.html;https://theleadsm.com/suns-going-streaking-with-12-straight-wins/?utm_source=rss&utm_medium=rss&utm_campaign=suns-going-streaking-with-12-straight-wins;https://www.hoopsrumors.com/2021/11/frank-kaminsky-suffers-stress-reaction-in-knee-out-indefinitely.html
8b86a6ce-aa64-4be4-9893-bfe0add30339,Enes Kanter,4.875,0.25,0.125,0.5,0.75,4.375,https://cdn.nba.com/headshots/nba/latest/260x190/202683.png,https://cdn.nba.com/logos/nba/1610612738/primary/L/logo.svg,Boston Celtics,12/6;12/1;11/29,"The Boston Celtics, on the second night of a back-to-back, were...;Ahead of the Knicks‘ eventual 112-110 loss to their cross-town...;The 2021-22 Boston Celtics have been quite average, and...","Chowder and Champions: Boston Celtics bounce back in the best way ever vs Trail Blazers;HoopsRumors: Atlantic Notes: Durant, Walker, Kanter, Riller;The Cold Wire: Who Is The Boston Celtics' X-Factor This Year?",https://chowderandchampions.com/2021/12/06/boston-celtics-bounce-back-vs-trail-blazers/;https://www.hoopsrumors.com/2021/11/atlantic-notes-durant-walker-kanter-riller.html;https://www.thecoldwire.com/who-is-the-boston-celtics-x-factor-this-year/
b010bdfb-b44c-47e2-863c-adcf761d4620,Luke Kennard,3.111111111111111,2.0,0.7222222222222222,0.1111111111111111,0.5,9.944444444444445,https://cdn.nba.com/headshots/nba/latest/260x190/1628379.png,https://cdn.nba.com/logos/nba/1610612746/primary/L/logo.svg,LA Clippers,12/8;12/4;12/4,"Our latest fantasy basketball waiver wire list has a mixture of...;When Luke Kennard received a 4 yr/$64 million contract extension...;STAPLES Center was nearly empty on Monday afternoon, but a 20-year-old...","SGPN: Fantasy Basketball Waiver Wire: Best Pickups Dec 8th;Fully Clips: LA Clippers' Luke Kennard earns expensive deal, puts Lakers in their place;Last Word on Sports: Brandon Boston Jr. Should Play",https://www.sportsgamblingpodcast.com/2021/12/08/fantasy-basketball-waiver-wire-best-pickups-dec-8th/;https://clipperholics.com/2021/12/03/la-clippers-luke-kennard-earns-expensive-deal-puts-lakers-in-place/;https://lastwordonsports.com/basketball/2021/12/03/brandon-boston-jr-should-play/
e84541c2-37f0-46bb-a7ff-356f9dd653d0,Corey Kispert,1.8823529411764703,0.5882352941176471,0.2352941176470588,0.1764705882352941,0.3529411764705882,3.5294117647058822,https://cdn.nba.com/headshots/nba/latest/260x190/1630557.png,https://cdn.nba.com/logos/nba/1610612764/primary/L/logo.svg,Washington Wizards,12/6;11/26;11/16,"The slumping Wizards are due for lineup changes when Rui Hachimura...;NBA Future Watch: Corey Kispert Basketball Cards, Washington Wizards...;These are the best of times for the Wizards, as their 10-3 record...","HoopsRumors: Wizards Notes: Hachimura, Bryant, Dinwiddie, Caldwell-Pope;GoGTS: NBA Future Watch: Corey Kispert Basketball Cards, Washington Wizards;HoopsWire: Wizards Rockin', Rollin' And Off To Best Start Since The 1970s",https://www.hoopsrumors.com/2021/12/wizards-notes-hachimura-bryant-dinwiddie-caldwell-pope.html;https://gogts.net/nba-future-watch-corey-kispert-basketball-cards-washington-wizards/;https://hoopswire.com/wizards-rockin-rollin-and-off-to-best-start-since-the-1970s/
a612ec3f-af3a-4cb9-929c-7706d612b1ba,Maxi Kleber,5.625,1.125,0.625,1.125,0.5,7.0,https://cdn.nba.com/headshots/nba/latest/260x190/1628467.png,https://cdn.nba.com/logos/nba/1610612742/primary/L/logo.svg,Dallas Mavericks,11/30;11/28;11/23,"Mavericks fans have been clamoring for Moses Brown to get a longer...;The Dallas Mavericks have to start big man Maxi Kleber moving...;Dallas Mavericks forward Maxi Kleber recently returned from injury,...","HoopsRumors: Southwest Notes: M. Brown, Grizzlies, Pelicans, Wall;The Smoking Cuban: Mavericks have to start Maxi Kleber moving forward;The Smoking Cuban: Should Maxi Kleber be in the Mavericks starting 5?",https://www.hoopsrumors.com/2021/11/southwest-notes-m-brown-grizzlies-pelicans-wall.html;https://thesmokingcuban.com/posts/mavericks-maxi-kleber-start-center;https://thesmokingcuban.com/posts/maxi-kleber-mavericks-starter
56b3d34f-4084-4ac0-bd8e-74f441a1ed3a,Nathan Knight,0.7142857142857143,0.4285714285714285,0.1428571428571428,0.1428571428571428,0.2857142857142857,1.7142857142857142,https://cdn.nba.com/headshots/nba/latest/260x190/1630233.png,https://cdn.nba.com/logos/nba/1610612750/primary/L/logo.svg,Minnesota Timberwolves,10/24;10/8;10/5,"Hoops Rumors is breaking down the 2021 offseason for all 30 NBA...;We have been waiting for a couple of seasons to see the Minnesota...;The preseason has arrived, and a critical Minnesota Timberwolves...",HoopsRumors: 2021 NBA Offseason In Review: Minnesota Timberwolves;Zone Coverage: What Fixes Do the Wolves Need To Prioritize To Become A Playoff Team?;Zone Coverage: Minnesota's First Preseason Game Gave Us A Lot To Chew On,https://www.hoopsrumors.com/2021/10/2021-nba-offseason-in-review-minnesota-timberwolves.html;https://zonecoverage.com/2021/timberwolves/what-fixes-do-the-wolves-need-to-prioritize-to-become-a-playoff-team/;https://zonecoverage.com/2021/timberwolves/minnesotas-first-preseason-game-gave-us-a-lot-to-chew-on/
fb0d0e6d-e64e-435b-aa7d-4ca55cb840b0,Kevin Knox,0.6666666666666666,0.3333333333333333,0.0,0.0,0.6666666666666666,0.3333333333333333,https://cdn.nba.com/headshots/nba/latest/260x190/1628995.png,https://cdn.nba.com/logos/nba/1610612752/primary/L/logo.svg,New York Knicks,12/4;11/27;11/14,"NBA draft classes typically need a few years before a true...;The red-hot Phoenix Suns solidly beat the Knicks at Madison Square...;In a game of runs, Kemba Walker led the Knicks to a 16-point,...",The Cold Wire: 3 Looming Busts From The 2018 NBA Draft Class;Knicks.City: Quickley Shines. But Suns Too Hot. Phoenix 118 NY 97;Knicks.City: Couldn't Hold the Lead. Charlotte 104 NY 96,https://www.thecoldwire.com/looming-busts-from-the-2018-nba-draft-class/;https://knicks.city/2021-22/quickley-shines-but-suns-too-hot-phoenix-118-ny-97/;https://knicks.city/2021-22/couldnt-hold-the-lead-charlotte-104-ny-96/
83cdf656-ca54-4007-80f0-db3fdbf8ac75,John Konchar,3.1875,1.0,0.625,0.25,0.5,2.3125,https://cdn.nba.com/headshots/nba/latest/260x190/1629723.png,https://cdn.nba.com/logos/nba/1610612763/primary/L/logo.svg,Memphis Grizzlies,12/1;9/16;8/4,"The Memphis Grizzlies have had an extremely up and down 2021 season....;The OKC Thunder owed the 21st selection in the 2019 NBA Draft...;In 2021, the Memphis Grizzlies will have two things that they...",Beale Street Bears: Memphis Grizzlies: Which players have disappointed in 2021?;Thunderous Intentions: OKC Thunder: B/R slots Lu Dort 14th in 2019 ReDraft;Beale Street Bears: Memphis Grizzlies: 3 starting lineups Taylor Jenkins has to try this season,https://bealestreetbears.com/2021/11/30/memphis-grizzlies-players-disappointed-2021/;https://thunderousintentions.com/2021/09/16/okc-thunder-lu-dort-14th-re-draft/;https://bealestreetbears.com/2021/08/04/memphis-grizzlies-3-lineups-taylor-jenkins-try-season/
